NODE_ID,SHORT_SUMMARY,TEXT_N
T_I_11112_213,MCC-s lószállító,"Az MCC-sek társadalmilag nem épp oly érzékenyek, mint gondotlad, és a lovakhoz raktak hátra. ikor megálltok egy benzinkútnál kiszálltok egy kis friss levegőért, azonban az egyik ló elfut mellettetek. 

Úgy döntötök jobb nem szólni, és leléptek inkább.

A kúton megpillantotok egy másik rajkos csapatot, akik épp technóra torzulgatnak tankolás közben, terrorizálva a helyi lakosságot. Az áldozatok között megpillantotok egy lovait nyugtató kocsist, aki épp csak ebédelni tért volna be. Épp elindultok feléjük, mikor egy limuzin-szerű autó téved arra OV felirattal.

Mit csinálsz?"
T_I_11112_214,UF-et megkérdezed mit gondol,"""Milyen jól megy az MCC-seknek, tudtam, hogy oda kellett volna jelentkeznem"" szólal meg melletted az UF vészjóslóan. 

Összenevettek. Értékeitek és elveitek miatt az Eis Kaffee-t szállító kamiont válsztjátok összhangban.

Mikor felszálltok a kamionra veszitek csak észre, hogy Mészi vezet állszakállban és álbajuszban.

""Nyomás"" sürget titeket, majd rálép a gázpedálra. Nem meritek megkérdezni, hogy honnan van a kamion tele Eis Kaffee-val, de mivel rábont egy Nógrádi ropogósra és egyből megkínál titeket, ezt most elengeditek neki. 

Mészi kiváló sofőrnek bizonyul, senkinek sem ment neki, egyszer sem fékezett túl semmit, és még a parkolást is ügyesen megoldotta. 

Ilyen sofőr mellett kényelmesen leértek az Attila mesél közepére. 

Leültök a legközelebbi padhoz, és az utolsó sorból hallgatjátok Attila megnyugtató hangját, aki ebben a pillanatban rátok mosolyog. Innen tudod, Attila büszke Rád.

""Minden megérte"" mormolod magadban."
T_I_11112_2111,technós rakjkosok,"Nagyon megörültök egymásnak. Kiderül, hogy ebben a vármegyében nem tilos 7-en ülni egy autóban, mert az gépkocsi fogalmát még nem fedezték fel itt. Ekkor már Viktor is ott áll mellettetek, összemosolyogtok.

""A jó Isten küldte nekünk Orbán Viktort"" kiálltja el magát valaki, ti pedig már-már önkéntelenül bólogattok erre.

Folytatjátok az utatokat a táborba immár 7-en. Nagyon jó a hangulat, de a plusz súly miatt az ideálisnál lassabban haladtok sajnos. 

Vacsorára értek oda az asztalokhoz, ami miatt mind elszomorodtok. Lekéstétek az Attila mesélt, de legalább az ismerkedős programon részt tudtok venni. Ez új erővel tölt el titeket, miközben vígan falatoztok az esti bőrös virslin és aznapos zsemlén.

Azért szép az élet, gondolod feltöltődve, kár lett volna disszidálni."
T_I_11112_2112,lovaskocsi,"A morális iránytűd miatt már a lovásszal beszélgetsz és szálsz föl mellé. Mikor elhagyjátok a benzinkutat egy forgalmatlan kerülőút felé jössz rá, hogy a társad nem téged választott. Vajon mi lehet az oka? Lamentálsz a döntéseiden, de semmi nem jut eszedbe.

A lovas kocsi nagyon lassan visz közelebb az úti célodhoz, az utolsó 10 kilómétert már sétálva teszed meg ráadásul.

Korahajnalban érkezel meg, de nagy fáradságodba már bulizni sincs kedved. Lekésted amiért siettél, és még panaszkodni sem tudsz másokra.

Fejedet lehajtva elszégyelled magad."
T_I_11112_2113,OV,"""Professzor Doktor Miniszterelnök Úr!"" kiálltotok fel mindketten.

Megrohamozzátok a kegyelmes úr hintaját, és szóba elegyedtek vele. Először megköszöntétek neki Sallai dupláját az angol-magyaron, és kíváncsian érdeklődtök, hogy az Elk*tuk nevében mit takar ki a csillag. Ezekről szívályesen elcseveg veletek a főnök. Egy ponton jelzi azonban, hogy most éppen fontos küldetésen van: épp járja az országot még egy kis misebor után, magyarázza, hátha az oroszok is kérnek. 

Bedobjátok, hogy a halál faszán van egy kis falu, ahol a népi kultúra érintetlensége miatt biztosan van sok misebor. Sőt, az ukrán határhoz jó közel is van. Megtetszik neki az ötlet, de vonakodik kicsit, mert már nagyon szeretne Stop Soros feliratokat rajzolgatni zsírkrétával a limóban. Végül csak sikerül meggyőzni azzal, hogy szeretnétek világra hozni még egy magyart, de ehhez szükséges egy nyugodt környezet, viszont errefele kötelező nemváltó műtétekkel riogatják a bölcsiseket. Belátja, hogy a körülmények így nem alkalmasak rendes, keresztény futballistát fogantatni, úgyhogy be is ültet a limóba.

Elindultok a pályán, hallgatva egy kellemes népi zenei lejátszási listát, melyet 1-1 klasszikus tör csak meg. Mikor felcsendül az ""Igen, igen"" mind elmorzsoltok egy örömkönnyet, hogy lassan másfél évtizede nem lövettek senki szeme közé.

Telik-múlik az idő, de csak leértek a nyári táborba. A miniszterelnöki kocsi olyan hamar levitt, hogy még Attilát sem látjátok.

Kis idő elteltével megjelenik mindenki. Leülsz a legközelebbi padhoz, és az első sorból hallgatod Attila megnyugtató hangját, aki ebben a pillanatban rádmosolyog. Innen tudod, Attila büszke Rád.

""Minden megérte"" mormolod magadban."
T_II_1,mi vaaaaaan,Odaszólsz miiivaaan