NODE_ID,SHORT_SUMMARY,TEXT_N
T_I_11112_213,MCC-s lószállító,"Az MCC-sek társadalmilag nem épp oly érzékenyek, mint gondotlad, és a lovakhoz raktak hátra. ikor megálltok egy benzinkútnál kiszálltok egy kis friss levegőért, azonban az egyik ló elfut mellettetek. 

Úgy döntötök jobb nem szólni, és leléptek inkább.

A kúton megpillantotok egy másik rajkos csapatot, akik épp technóra torzulgatnak tankolás közben, terrorizálva a helyi lakosságot. Az áldozatok között megpillantotok egy lovait nyugtató kocsist, aki épp csak ebédelni tért volna be. Épp elindultok feléjük, mikor egy limuzin-szerű autó téved arra OV felirattal.

Mit csinálsz?"
T_I_11112_214,UF-et megkérdezed mit gondol,"""Milyen jól megy az MCC-seknek, tudtam, hogy oda kellett volna jelentkeznem"" szólal meg melletted az UF vészjóslóan. 

Összenevettek. Értékeitek és elveitek miatt az Eis Kaffee-t szállító kamiont válsztjátok összhangban.

Mikor felszálltok a kamionra veszitek csak észre, hogy Mészi vezet állszakállban és álbajuszban.

""Nyomás"" sürget titeket, majd rálép a gázpedálra. Nem meritek megkérdezni, hogy honnan van a kamion tele Eis Kaffee-val, de mivel rábont egy Nógrádi ropogósra és egyből megkínál titeket, ezt most elengeditek neki. 

Mészi kiváló sofőrnek bizonyul, senkinek sem ment neki, egyszer sem fékezett túl semmit, és még a parkolást is ügyesen megoldotta. 

Ilyen sofőr mellett kényelmesen leértek az Attila mesél közepére. 

Leültök a legközelebbi padhoz, és az utolsó sorból hallgatjátok Attila megnyugtató hangját, aki ebben a pillanatban rátok mosolyog. Innen tudod, Attila büszke Rád.

""Minden megérte"" mormolod magadban."
T_I_11112_2111,technós rakjkosok,"Nagyon megörültök egymásnak. Kiderül, hogy ebben a vármegyében nem tilos 7-en ülni egy autóban, mert az gépkocsi fogalmát még nem fedezték fel itt. Ekkor már Viktor is ott áll mellettetek, összemosolyogtok.

""A jó Isten küldte nekünk Orbán Viktort"" kiálltja el magát valaki, ti pedig már-már önkéntelenül bólogattok erre.

Folytatjátok az utatokat a táborba immár 7-en. Nagyon jó a hangulat, de a plusz súly miatt az ideálisnál lassabban haladtok sajnos. 

Vacsorára értek oda az asztalokhoz, ami miatt mind elszomorodtok. Lekéstétek az Attila mesélt, de legalább az ismerkedős programon részt tudtok venni. Ez új erővel tölt el titeket, miközben vígan falatoztok az esti bőrös virslin és aznapos zsemlén.

Azért szép az élet, gondolod feltöltődve, kár lett volna disszidálni."
T_I_11112_2112,lovaskocsi,"A morális iránytűd miatt már a lovásszal beszélgetsz és szálsz föl mellé. Mikor elhagyjátok a benzinkutat egy forgalmatlan kerülőút felé jössz rá, hogy a társad nem téged választott. Vajon mi lehet az oka? Lamentálsz a döntéseiden, de semmi nem jut eszedbe.

A lovas kocsi nagyon lassan visz közelebb az úti célodhoz, az utolsó 10 kilómétert már sétálva teszed meg ráadásul.

Korahajnalban érkezel meg, de nagy fáradságodba már bulizni sincs kedved. Lekésted amiért siettél, és még panaszkodni sem tudsz másokra.

Fejedet lehajtva elszégyelled magad."
T_I_11112_2113,OV,"""Professzor Doktor Miniszterelnök Úr!"" kiálltotok fel mindketten.

Megrohamozzátok a kegyelmes úr hintaját, és szóba elegyedtek vele. Először megköszöntétek neki Sallai dupláját az angol-magyaron, és kíváncsian érdeklődtök, hogy az Elk*tuk nevében mit takar ki a csillag. Ezekről szívályesen elcseveg veletek a főnök. Egy ponton jelzi azonban, hogy most éppen fontos küldetésen van: épp járja az országot még egy kis misebor után, magyarázza, hátha az oroszok is kérnek. 

Bedobjátok, hogy a halál faszán van egy kis falu, ahol a népi kultúra érintetlensége miatt biztosan van sok misebor. Sőt, az ukrán határhoz jó közel is van. Megtetszik neki az ötlet, de vonakodik kicsit, mert már nagyon szeretne Stop Soros feliratokat rajzolgatni zsírkrétával a limóban. Végül csak sikerül meggyőzni azzal, hogy szeretnétek világra hozni még egy magyart, de ehhez szükséges egy nyugodt környezet, viszont errefele kötelező nemváltó műtétekkel riogatják a bölcsiseket. Belátja, hogy a körülmények így nem alkalmasak rendes, keresztény futballistát fogantatni, úgyhogy be is ültet a limóba.

Elindultok a pályán, hallgatva egy kellemes népi zenei lejátszási listát, melyet 1-1 klasszikus tör csak meg. Mikor felcsendül az ""Igen, igen"" mind elmorzsoltok egy örömkönnyet, hogy lassan másfél évtizede nem lövettek senki szeme közé.

Telik-múlik az idő, de csak leértek a nyári táborba. A miniszterelnöki kocsi olyan hamar levitt, hogy még Attilát sem látjátok.

Kis idő elteltével megjelenik mindenki. Leülsz a legközelebbi padhoz, és az első sorból hallgatod Attila megnyugtató hangját, aki ebben a pillanatban rádmosolyog. Innen tudod, Attila büszke Rád.

""Minden megérte"" mormolod magadban."
T_II_0,mi vaaaaaan,Odaszólsz miiivaaan
T_II_1_jo,leértél tegnap Attila mesélre,"Mosolyogva kelsz másnap reggel. Ahogy kifordulsz az ágyból szinte süt rólad az energia, jegyzi meg a szobatársad. ""Hehe, ez de buzis volt"" veted oda válaszul.

Mivel a tegnapi ruhádban aludtál fel sem kell öltöznöd, és már el is ballagsz az étkezdébe. A nap legfontosabb étkezése ma egy okésan száraz zsemle, miniatűr, külön műanyagba csomagolt vaj, illetve mellé ugyanígy tárolt cukordzsem, illetve pár picassoi gonddal elhelyezett löncspárizsi az ínyenceknek. A táskádat valaki bementette a közös buszról tegnap, azon gondolkodsz, hogy csomagoltál-e valami ételt.

Mit csinálsz? "
T_II_1_kozepes,pont nem értél le tegnap Attila mesélre,"Tegnap a kései érkezés miatt körülbelül 2 órával később ittad magad tudatlanra, mint a medián, így ~2 órával később is mentél aludni, így ~2 órával kevesebbet is aludtál. A tegnapi után kellett még ez a fejfájós reggel, mint egy falat kenyér.

Apropó falat kenyér, kéne egyet reggelizni ha már fizettél érte. A tegnapi ruháidban már el is ballagsz az étkezdébe. A nap legfontosabb étkezése ma egy okésan száraz zsemle, miniatűr, külön műanyagba csomagolt vaj, illetve mellé ugyanígy tárolt cukordzsem, illetve pár picassoi gonddal elhelyezett löncspárizsi az ínyenceknek. A táskádat valaki bementette a közös buszról tegnap, azon gondolkodsz, hogy csomagoltál-e valami ételt.

Mit csinálsz? "
T_II_1_rossz,mindent lekéstél,"Olyan későn és nehezen értél le tegnap, hogy ma már később is keltél az átlagnál. Rövid kelés után gyorsan az étkezőbe sietsz, hogy még valamit bements a reggeli turnusból. 

Meghökkenve tapasztalod, hogy szinte minden másik rajkos már nagyban reggelizget. Ekkor érkezik meg Grenczer Máté, Mizsák Máté és Gémes Imi, veled szinte párhuzamosan eszmélnek ugyanerre. Nem hallod pontosan, hogy melyikük, de az egyik Máté fel is hozza ezt, melyen összemosolyogtok, Imi barátságosan fel is nevet. Innen arra következtetsz, hogy Mizsák mondhatta, és kicsit szélesebben elmosolyodsz.

Ugyanilyen félkomolyan mondja be, hogy most mival, a maradék 2 zsemléért meg 2 löncshúsért vajon meg kell küzdenetek, hogy ne menjen a társaság fele éhesen neki az Önmarci napnak. Ezen egy rövid ideig elmosolyodtok megint, de Grenczernek meg neked kicsit az arcodra fagy a mosoly, mikor meglátod Máté és Imi szemében az éhség árulkodó nyomait. Ismét megcsapja a füledet Imi sugárzó kacaja, de mostmár csak Mizsák mosolyog mellette mohón.

Mindketten kinyomnának titeket Grenczerrel fekve, ha akarnának, ez tény. Felméred, hogy a zsemle és a löncspárizsi egymással szemben helyezkedik el, esélytelen mindkettőt előbb elcsípned, mint ez a páratlan páros. Grenczer kollegára nézel, aki ugyanezen dillemázhat. Ha egyszerre elkezdtek futni az arra a kajára, amelyikre számításaid szerint később érnek oda a srácok, akkor még van esélyetek enni valamit mielőtt leültök 12 órára önmarcizni. 

Mit csinálsz?"
T_II_11,vaj hús,"A melletted ülő egészség- és környezet tudatos rajkos társad már el is kezdi mondani neked, hogy a hús miért nem létszükséglet. Továbbá, környezetvédelmi szempontból a húsevő étrend egy fenntarthatatlan vagy luxus étkezési szokás lesz 10-20 éven belül. Megnyugtatod, hogy ebben semmi hús nincs, majd lenyeled az utolsó falatot, és megnyalod mind a 10 ujjad. Jól esett megnyerni egy vitát már a nap elején. ""Gyere rám önmarci,"" gondolod magadban.

Reggeli után minden évfolyamtársad elkezd gyülekezni egy helyen. Azonban egy végzős spanod melletted kezd el cigit tekerni, ami ihletet ad.

Mit csinálsz?"
T_II_12,vaj dzssem,"""Egészségetekre"" mondjátok egymásnak a kantinban. Ez a jó lekváros zsömi kicsit feldobott, adott kis lendületet is.

Ahogy lenyeled az utolsó falatot észreveszed, hogy az évfolyamtársaid már indulásra készen várnak. Ahogy felállsz kiesik egy szűrő a zsebedből az asztalra, majd a kezedbe, majd már a szádban is pihen. Jajj, ne, gondolod szomorúan. Most vajon ki kellene dobni ezt a hibátlan szűrőt, tűnődsz el.

Mit csinálsz?"
T_II_13,dzsem hús,"Mindenki elborzad kicsit körülötted. Kivéve a Nyáry Janit, ő elismerően bólogat féloldalasan. 

Miután jól befaltad 4 ember reggelijét, már el is indulsz az önmarci-gyülekező spot felé. Annyi energiát adott a sok táplálék, hogy mindenkit leköröztél, ott állsz egy dohánypakkal a zsebedben, várakozva. 

Mit csinálsz?"
T_II_14,táska?,"Elindulsz a táskád felé, amit bent hagytál a kisházatokban. Fogalmad sincs az melyik. Pár perc keresgélés után elfáradsz, de pont jön szembe egy náyri tábor szervező, aki éppen egy nála nagyobb talicskát próbál hegynek felfele tolni, tele tüzifával. 

Mit csinálsz? "
T_II_31,húsra futottál,"G. Mátéval azonnal megértitek egymást, és eliramodtok az ételek felé. M. Máté és Imre századmásodpercekkel vannak lemaradva, de a döntő pillanatban a másik irányba veszik az irányt. Szátokban a hússal leültök a falatozó srácok mellé és nevetgélve megreggeliztek. 

Semmire nem volt elég ez a reggeli, ezért sietve elindulsz a táskád felé. A baj, hogy fogalmad sincs melyik a ti vityillótok. Pár perc keresgélés után elfáradsz, de pont jön szembe egy náyri tábor szervező, aki éppen egy nála nagyobb talicskát próbál hegynek felfele tolni, tele tüzifával. 

Mit csinálsz? "
T_II_32,zsemlére futottál,"Alig volt időd elköteleződni egy válsztás mellett, mikor észleled, hogy az izmos duó már el is iramodott az étel felé. Mátéval utánuk iramodtok, annak reményében, hogy marad nektek valami. A választásod ugyan feleslegesnek bizonyult, de eltaláltad: a maradék hús fogyott el mire az asztal másik végébe értetek. Küzdős volt, de fejenként egy félszáraz zsemle volt a jussotok, már el is majszoljátok az asztal mellett.

Semmire nem volt elég ez a reggeli, ezért sietve elindulsz a táskád felé. A baj, hogy fogalmad sincs melyik a ti vityillótok. Pár perc keresgélés után elfáradsz, de pont jön szembe egy náyri tábor szervező, aki éppen egy nála nagyobb talicskát próbál hegynek felfele tolni, tele tüzifával. 

Mit csinálsz? "
T_II_111,cigi nélkül önmarcika,"Az évfolyamoddal kerestek egy megnyugtató helyet a tábor területén. Neked nincs sok ötleted, de erős preferenciád sem, hogy hol legyetek.

Leültök végre egy körbe, kezdődik az önmarci.

Hanyadiknak szeretnél jönni?"
T_II_112,cigivel önmarcika,"Jól esik ez a reggeli cigi. Egy kávé mellőle nagyon hiányzik, de egy tusolást is el tudnál fogadni. Najó azért mostmár úgy döntesz, hogy megtiszteeld az évfolyamod maradékát és inkább csatlakozol.

Egy kellemes félreeső zugot találtak közben, be is csatlakozol a körbe. Pár ember arca kétségbeesést és rettegést tükröz, mások magabiztosan olvasgatják a jegyzeteiket, megint mások meg indifferensen, vagy talán enyhén unottan néznek maguk elé. Szerintük biztos nem ez a legjobb módja a visszajelzésnek.

Mindenki a helyén, kezdődik az önmarci.

Hanyadiknak szeretnél jönni?"
T_II_141,füllhallgató a fülbe,"Megúsztad a munkát, szép munka. Ahogyan elmegy melletted a fiatal tag meglátod egy szobatársadat kijönni egy bungallóból a túloldallon, egyből meg is célzod. Megtalálod a táskád, benne a teljes dohányszetteddel. Ételt nemigen találsz, de egy megkezdett chips is több lehet mint a semmi. 

Mit csinálsz?"
T_II_142,asszertív megállítás,"""Na heló, Öcsi"" állítod meg. ""Istenem mi van már megint"" válaszol nem épp türelmesen. Több sem kellett neked, már neki is állsz bő 5 percig kioktatni őt az intézmény és az idősek tiszteletéről. Emlékezteted, hogy bizottsági tag vagy, nélküled nem lenne fa, amit cipelnie kell. 

A lebaszás jól esett, de a nagy hévben elfelejtetted megkérdezni tőle a szobád számát. 1-1, zárod le magadban a találkozót. 

Találsz egy dohánycuccot a lépcsőn, amire lehevertél megint. Ugyanott egy tegapról megmaradt pizzaszeletet is találsz a kövön, mely eszedbejuttatta, milyen éhes vagy. 

Mit csinálsz?"
T_II_1411,kaja nem cigi,"Épp élkezdhetnéd élvezn, hogy étel kerülhet a szervezetedbe, mikor az egyik évfolyamtársad meglát. Szúrós szemmel néz rád, és megkér, hogy ""gyere mostmár, a büdös kis faszom"". Felhívod a figyelmét, hogy ""jól van már nem lehet az embernek egy perc nyugta sem.""

Éhesen kiforduslz magadból kicsit, konstatálod. De kitartasz az igazad mellett.

Elindultok közösen egy félreeső kis helyre. Pár ember arca kétségbeesést és rettegést tükröz, mások magabiztosan olvasgatják a jegyzeteiket, megint mások meg indifferensen, vagy talán enyhén unottan néznek maguk elé. Szerintük biztos nem ez a legjobb módja a visszajelzésnek.

Mindenki a helyén, kezdődik az önmarci.

Hanyadiknak szeretnél jönni?"
T_II_1412,cigi nem kaja,"Abban a percben, hogy rágyújtasz, az egyik évfolyamtársad meglát. Szúrós szemmel néz rád, és megkér, hogy ""gyere mostmár, a büdös kis faszom"". Felhívod a figyelmét, hogy ""jól van már nem lehet az embernek egy perc nyugta sem.""
Éhesen kiforduslz magadból kicsit, konstatálod. De kitartasz az igazad mellett.

Elindultok közösen egy félreeső kis helyre. Pár ember arca kétségbeesést és rettegést tükröz, mások magabiztosan olvasgatják a jegyzeteiket, megint mások meg indifferensen, vagy talán enyhén unottan néznek maguk elé. Szerintük biztos nem ez a legjobb módja a visszajelzésnek.

Mindenki a helyén, kezdődik az önmarci.

Hanyadiknak szeretnél jönni?"
T_II_1111,elsőnek jössz,"Nem látod az értelmét a teketóriázásnak, bele is kezdesz. 

Az elején kell kezdeni a sztoridat is. Nem éppen klasszikusnak mondható éved volt, miután SZIB vezetőnek választottak október elején még mindenki örült, hogy kezded megtalálni a helyed az intézményi rendszerünkben is. Később dilemmákba kerültél a Könyvtáros és Nyomtató felelős pozíciók között, de mindnkettőre elindultál. Mivel mindenki érezte a szinergiákat, SZIB főnökként behúztad a nyomtatós melót, de a másikat egy lelked UF kapta, a kis piszok. Ezek után meg már felháborított kicsit, hogy TAXI-snak nem választottak meg. Jó nem tudod mit rövidít, de az UF-ekre nagyon odaakartál figyelni, és szomorúan kellett konstatálnod, hogy így már semmi lehetőség vagy felelősség nincs a te válladon az UF-ek kapcsán. Sőt, ez kicsit dühített is, de nincs mit tenni. 

Hogy értékeled az intézményi kalandozásodat?"
T_II_1112,11-nek jössz,"Udvariasan kiváord a sorodat, majd bele is kezdesz. 

Az elején kell kezdeni a sztoridat is. Nem éppen klasszikusnak mondható éved volt, miután SZIB vezetőnek választottak október elején még mindenki örült, hogy kezded megtalálni a helyed az intézményi rendszerünkben is. Később dilemmákba kerültél a Könyvtáros és Nyomtató felelős pozíciók között, de mindnkettőre elindultál. Mivel mindenki érezte a szinergiákat, SZIB főnökként behúztad a nyomtatós melót, de a másikat egy lelked UF kapta, a kis piszok. Ezek után meg már felháborított kicsit, hogy TAXI-snak nem választottak meg. Jó nem tudod mit rövidít, de az UF-ekre nagyon odaakartál figyelni, és szomorúan kellett konstatálnod, hogy így már semmi lehetőség vagy felelősség nincs a te válladon az UF-ek kapcsán. Sőt, ez kicsit dühített is, de nincs mit tenni. 

Hogy értékeled az intézményi kalandozásodat?"
T_II_11111,áldozat intézmény,"Jól van furcsán néznek de ez nem tántorít el, most jön a dzsúsz még csak úgyis. 

Mert ugyanis a legfrissebb évfolyam elől titkosan megrendezésre került egy Cs-est és Lánynap a napokban. Na meg volt egy másik októberben is. Nem is tudod melyikkel kezdd.

Mit csinálsz?"
T_II_11112,megbocsátasz intézmény,"Jól van furcsán néznek de ez nem tántorít el, most jön a dzsúsz még csak úgyis. 

Mert ugyanis a legfrissebb évfolyam elől titkosan megrendezésre került egy Cs-est és Lánynap a napokban. Na meg volt egy másik októberben is. Nem is tudod melyikkel kezdd.

Mit csinálsz?"
T_II_11111_1,A júniusi lánynappal kezdesz.,"Összeszorított fogakkal elemzed az aznap elrontott pillanatokat, de az örömteli találatok és a végén a lerakott teljesítmény örömével térsz nyugovóra. Egész jól bírtad szusszal is az estét.

Csak aztán megjöttek a csajok és elindult a bajvonat. Nem voltál felkészülve arra, hogy a Nyomtató fontos része a koreónak, és a Poszt-UF-ek így kénytelenek voltak a kezükkel takarni a micsodájukat a kinyomtatott vállgazd tankönyvek helyett. Minden nagyon jól sült el a végén, így még talán jobban is élvezték az ittasabb hölgyek. Az ügyesebb első sorban ülők ingyen zoknit is szerezhettek.

Hogy értékeled a saját teljesítményedet ebben az egészben?"
T_II_11111_2,Az októeri lánynappal kezdesz.,"Azzal az estével nem is lett volna baj, hogyha nem használod ki az emberfeletti sármaidat a gyanútlan legfiatalabb korosztállyal szemben. Csorbult a józan ész elve, ugyanis a pillanat hevében összekavartál a legfiatalabb UF-fel, pedig még párja is volt ezidőben. Meg neked is, sőt itt ül tőled hárommal balra a szerencsétlen. Legalább gálánsan dobtad 2-3 héttel később, hogy ne legyen neki gyanús. 

De ez még nem is lenne akkora baj, ha nem a könyvtárban csináltátok volna, amivel a helyi tanulótárs-növényt sem nyírtátok volna ki. Szegény jeszkes, akit az óvatlan kezelés miatt másnap le is váltottak a könyvtáros poziból. Sajnos ő meg kettővel ül melletted balra, épp kedvesen fogva az exed kezét.

Mit mondasz el ezekből az évfolyamtársaidnak?"
T_II_11111_11,"októberi lánynap a második, okés vagy magaddal","Megnyugodtál kicsit, jól esett ezeket kimondani. Most viszont át is nyargalsz a másik lánynapra, attól kicsit jobban félsz.

Azzal az estével nem is lett volna baj, hogyha nem használod ki az emberfeletti sármaidat a gyanútlan legfiatalabb korosztállyal szemben. Csorbult a józan ész elve, ugyanis a pillanat hevében összekavartál a legfiatalabb UF-fel, pedig még párja is volt ezidőben. Meg neked is, sőt itt ül tőled hárommal balra a szerencsétlen. Legalább gálánsan dobtad 2-3 héttel később, hogy ne legyen neki gyanús. 

De ez még nem is lenne akkora baj, ha nem a könyvtárban csináltátok volna, amivel a helyi tanulótárs-növényt sem nyírtátok volna ki. Szegény jeszkes, akit az óvatlan kezelés miatt másnap le is váltottak a könyvtáros poziból. Sajnos ő meg kettővel ül melletted balra, épp kedvesen fogva az exed kezét.

Mit mondasz el ezekből az évfolyamtársaidnak?"
T_II_11111_12,"októberi lánynap a második, haragszol magadra","Önmarcangolsz, önostorozol, kicsit önfasztszopkodva. Most viszont át is nyargalsz a másik lánynapra, attól kicsit jobban félsz.

Azzal az estével nem is lett volna baj, hogyha nem használod ki az emberfeletti sármaidat a gyanútlan legfiatalabb korosztállyal szemben. Csorbult a józan ész elve, ugyanis a pillanat hevében összekavartál a legfiatalabb UF-fel, pedig még párja is volt ezidőben. Meg neked is, sőt itt ül tőled hárommal balra a szerencsétlen. Legalább gálánsan dobtad 2-3 héttel később, hogy ne legyen neki gyanús. 

De ez még nem is lenne akkora baj, ha nem a könyvtárban csináltátok volna, amivel a helyi tanulótárs-növényt sem nyírtátok volna ki. Szegény jeszkes, akit az óvatlan kezelés miatt másnap le is váltottak a könyvtáros poziból. Sajnos ő meg kettővel ül melletted balra, épp kedvesen fogva az exed kezét.

Mit mondasz el ezekből az évfolyamtársaidnak?"
T_II_11111_21,semmit nem vallasz be 1,"""Naszóval a legnagyobb probléma nem is velem volt, hanem hogy mennyire sokat ittam. És hát így hamar kidőltem, és mentem aludni. Ja még a könyvtárban néztem egy kis teniszt lefekvés előtt, de aztán olyan hamar eljöttem onnan, hogy fogalmam sincs mi történhetett még aznap este"" füllented.

Vannak akik elhiszik, mások kevésbé. Kb. hihetőre sikerült a sztory. Át is tereled a szót gyorsan a közelmúlt eseményére.

Összeszorított fogakkal elemzed az aznap elrontott pillanatokat, de az örömteli találatok és a végén a lerakott teljesítmény örömével térsz nyugovóra. Egész jól bírtad szusszal is az estét.

Csak aztán megjöttek a csajok és elindult a bajvonat. Nem voltál felkészülve arra, hogy a Nyomtató fontos része a koreónak, és a Poszt-UF-ek így kénytelenek voltak a kezükkel takarni a micsodájukat a kinyomtatott vállgazd tankönyvek helyett. Minden nagyon jól sült el a végén, így még talán jobban is élvezték az ittasabb hölgyek. Az ügyesebb első sorban ülők ingyen zoknit is szerezhettek.

Hogy értékeled a saját teljesítményedet ebben az egészben?"
T_II_11111_22,könyvtárat vallod be 1,"""Be kell valljak valamit."" kezded baljósan. Nagy szüneteket tartasz a drámai hatás keltése érdekében. Kiélvezed a szituáció adta lehetőséget. ""Tudom mi tortént a könyvátarban a lánynap után."" Na most lett hirtelen teljes a feszült csend. ""Remélem nem miattad gondolkodnak a Lakóbiz létrehozásán a Könyvtáros és Szintfelelős összevonásával"" köpi be valaki a tömegből. 

Ihh, ebbe nem is gondoltál bele. De ez a DB híresen jó döntéseket hoz, ebben a félévben még csak 10-en léptek ki de már egy normálisnál kisebb nefelejcs gondolatáról csiripelnek a madarak. Minimum egy szimpátiaszavazáson át kell mennie egy ilyen szintű dolognak. 

Ez a gondolat megnyugtat, és elmondod, hogy te vagy a felelős. 

Főzi segít megállítani egy tömegbunyót mikor rádugrik az ex-könyvtáros. De legalább senki nem firtatja a miértjét vagy higyanját.

Megnyugszol kicsit, majd át is tereled a szót gyorsan a közelmúlt eseményére.

Összeszorított fogakkal elemzed az aznap elrontott pillanatokat, de az örömteli találatok és a végén a lerakott teljesítmény örömével térsz nyugovóra. Egész jól bírtad szusszal is az estét.

Csak aztán megjöttek a csajok és elindult a bajvonat. Nem voltál felkészülve arra, hogy a Nyomtató fontos része a koreónak, és a Poszt-UF-ek így kénytelenek voltak a kezükkel takarni a micsodájukat a kinyomtatott vállgazd tankönyvek helyett. Minden nagyon jól sült el a végén, így még talán jobban is élvezték az ittasabb hölgyek. Az ügyesebb első sorban ülők ingyen zoknit is szerezhettek.

Hogy értékeled a saját teljesítményedet ebben az egészben?"
T_II_11111_23,UF-et vallod be 1,"Nem kertelsz semmit, elmondod a sztorit. Döbbent csönd követi, 1-1 dühös nézést érzel a homlokodon, ahogyan lesütöd a szemed. A melletted ülő spanod azért minden feltűnést kerülve nyújt egy öklöst. Leöklözöd az asztal alatt, és elmosolyodsz, de rögtön inkább elkezded terelni a szót. Azért ez elég megosztó volt, de ezt tudtad előre.

Áttérsz a másik lánynapi élményeidre. Összeszorított fogakkal elemzed az aznap elrontott pillanatokat, de az örömteli találatok és a végén a lerakott teljesítmény örömével térsz nyugovóra. Egész jól bírtad szusszal is az estét.

Csak aztán megjöttek a csajok és elindult a bajvonat. Nem voltál felkészülve arra, hogy a Nyomtató fontos része a koreónak, és a Poszt-UF-ek így kénytelenek voltak a kezükkel takarni a micsodájukat a kinyomtatott vállgazd tankönyvek helyett. Minden nagyon jól sült el a végén, így még talán jobban is élvezték az ittasabb hölgyek. Az ügyesebb első sorban ülők ingyen zoknit is szerezhettek.

Hogy értékeled a saját teljesítményedet ebben az egészben?"
